title,source,category,language,published_at,reading_time_minutes,url,content
"AI In Education: New Classroom Tools","TechDaily","Technology","en","2026-06-01T09:10:00Z",6,"https://example.com/a1","Schools are adopting AI tutoring systems to improve personalized learning and student outcomes."
"Global Markets Rally On Policy Shift","FinanceWire","Economy","en","2026-06-01T11:20:00Z",5,"https://example.com/a2","Investors reacted positively to central bank signals and markets rallied across regions."
"Climate Startups Raise Record Funding","GreenPost","Environment","en","2026-06-02T07:45:00Z",7,"https://example.com/a3","Climate technology startups raised record funding to scale renewable solutions and storage."
"Nuevos avances en salud digital","SaludHoy","Health","es","2026-06-02T13:00:00Z",4,"https://example.com/a4","Los hospitales implementan plataformas de salud digital para mejorar la atencion y reducir costos."
"Sports Analytics Changing Team Strategy","SportSphere","Sports","en","2026-06-03T10:30:00Z",5,"https://example.com/a5","Teams use predictive analytics to optimize player rotation, injury prevention, and game strategy."
"Cybersecurity Alerts Rise in Q2","TechDaily","Technology","en","2026-06-03T14:15:00Z",6,"https://example.com/a6","Security teams reported an increase in phishing and ransomware campaigns during Q2."
"Urban Mobility and Electric Buses","CityNews","Transport","en","2026-06-04T08:05:00Z",5,"https://example.com/a7","Cities are expanding electric bus fleets to reduce emissions and improve transit reliability."
"E-commerce Logistics Gets Faster","RetailNow","Business","en","2026-06-04T16:40:00Z",4,"https://example.com/a8","Retailers invested in regional warehouses and route optimization to cut delivery times."
"AI Regulation Debate Expands","PolicyWatch","Politics","en","2026-06-05T09:55:00Z",8,"https://example.com/a9","Lawmakers debated transparency requirements and accountability rules for AI systems."
"Tourism Rebounds With New Routes","TravelBeat","Travel","en","2026-06-05T12:25:00Z",5,"https://example.com/a10","Airlines opened new routes and tourism demand increased in multiple destinations."
"Fintech Apps Gain User Trust","FinanceWire","Economy","en","2026-06-06T11:00:00Z",6,"https://example.com/a11","Fintech applications introduced clearer fees and stronger fraud controls to build trust."
"Agriculture Sensors Improve Yields","AgriWorld","Environment","en","2026-06-06T15:20:00Z",7,"https://example.com/a12","Farmers use connected sensors to monitor irrigation and improve crop yields."
